{
  "component": "button",
  "date": "2026-06-03",
  "compareReport": "docs/pf-compare/button.json",
  "compareDate": "2026-06-03",
  "status": "partial",
  "summary": {
    "total": 10,
    "implemented": 5,
    "skipped": 5,
    "failed": 0,
    "remaining": 0
  },
  "items": [
    {
      "number": 1,
      "type": "fix_icon",
      "title": "Favorite",
      "result": "skipped_user",
      "reason": "PFJ intentionally uses Red Hat star icons — design choice, not a bug"
    },
    {
      "number": 2,
      "type": "fix_attribute",
      "title": "Hamburger aria-expanded",
      "result": "skipped_user",
      "reason": "aria-expanded is set dynamically when used in masthead toggle, not on standalone button"
    },
    {
      "number": 3,
      "type": "fix_attribute",
      "title": "Hamburger aria-label",
      "result": "skipped_user",
      "reason": "PFJ uses 'Menu' which is more semantic than PF's 'Hamburger' — design choice"
    },
    {
      "number": 4,
      "type": "add_variation",
      "title": "Hamburger expanded/collapsed",
      "result": "skipped_user",
      "reason": "Animated button states already implemented in component; demo expansion not needed"
    },
    {
      "number": 5,
      "type": "fix_icon",
      "title": "Plain with no padding icon",
      "result": "skipped_user",
      "reason": "Demo icon choice (close vs question-circle) is a showcase styling decision"
    },
    {
      "number": 6,
      "type": "implement_feature",
      "title": "Stateful variants",
      "result": "implemented",
      "filesModified": [
        "showcase/src/main/java/org/patternfly/showcase/component/ButtonComponent.java"
      ],
      "reason": "Added clicked variants, plain stateful variants, and plain with count sub-groups"
    },
    {
      "number": 7,
      "type": "implement_feature",
      "title": "Plain with text variant",
      "result": "implemented",
      "filesModified": [
        "showcase/src/main/java/org/patternfly/showcase/component/ButtonComponent.java"
      ],
      "reason": "Added plain button with icon+text to variant examples"
    },
    {
      "number": 8,
      "type": "fix_attribute",
      "title": "Links as buttons tabindex",
      "result": "implemented",
      "filesModified": [
        "showcase/src/main/java/org/patternfly/showcase/component/ButtonComponent.java"
      ],
      "reason": "Changed disabled link tabindex from '0' to '-1' to match PF"
    },
    {
      "number": 9,
      "type": "add_variation",
      "title": "Links as buttons danger secondary",
      "result": "implemented",
      "filesModified": [
        "showcase/src/main/java/org/patternfly/showcase/component/ButtonComponent.java"
      ],
      "reason": "Added danger secondary link variant to Links as buttons demo"
    },
    {
      "number": 10,
      "type": "add_variation",
      "title": "Call to action disabled",
      "result": "implemented",
      "filesModified": [
        "showcase/src/main/java/org/patternfly/showcase/component/ButtonComponent.java"
      ],
      "reason": "Added disabled CTA variants (primary, secondary, tertiary, link)"
    }
  ]
}
